,signer,signing_date,title
24,Biden,2021-01-21,Establishing the COVID-19 Pandemic Testing Board and Ensuring a Sustainable Public Health Workforce for COVID-19 and Other Biological Threats
25,Biden,2021-01-21,Improving and Expanding Access to Care and Treatments for COVID-19
26,Biden,2021-01-21,Promoting COVID-19 Safety in Domestic and International Travel
27,Biden,2021-01-21,Protecting Worker Health and Safety
28,Biden,2021-01-21,Supporting the Reopening and Continuing Operation of Schools and Early Childhood Education Providers
29,Biden,2021-01-21,A Sustainable Public Health Supply Chain
30,Biden,2021-01-20,Advancing Racial Equity and Support for Underserved Communities Through the Federal Government
31,Biden,2021-01-20,Ensuring a Lawful and Accurate Enumeration and Apportionment Pursuant to the Decennial Census
32,Biden,2021-01-20,Organizing and Mobilizing the United States Government To Provide a Unified and Effective Response To Combat COVID-19 and To Provide United States Leadership on Global Health and Security
33,Biden,2021-01-20,Preventing and Combating Discrimination on the Basis of Gender Identity or Sexual Orientation
34,Biden,2021-01-20,Ethics Commitments by Executive Branch Personnel
35,Biden,2021-01-20,Protecting Public Health and the Environment and Restoring Science To Tackle the Climate Crisis
36,Biden,2021-01-20,Protecting the Federal Workforce and Requiring Mask-Wearing
37,Biden,2021-01-20,Revocation of Certain Executive Orders Concerning Federal Regulation
38,Biden,2021-01-20,Revision of Civil Immigration Enforcement Policies and Priorities
